{"cpp_matching":{"1":{"baseline":{"checksum":"450015000","operations":60000,"pairs":30000,"sha256":"9faba6a1526a023ec73d0f32cea4a3cba83c459407a8585a49f685fe83970b5b","threads":1,"throughput_ops_per_second":4435634.616964099,"timing":{"mad_ns":1262529.0,"max_ns":17521079.0,"mean_ns":14178082.24,"median_ns":13526813.0,"min_ns":12264284.0,"p95_ns":16583667.399999997,"raw_ns":[12434297.0,15875029.0,12690168.0,15489305.0,12418894.0,15238681.0,12264284.0,15563615.0,13299985.0,16760827.0,13526813.0,15723403.0,12347909.0,15812575.0,12496870.0,15339501.0,12438834.0,15613600.0,12574265.0,15854618.0,12485684.0,17521079.0,12461557.0,15513310.0,12706953.0],"samples":25}},"optimized":{"checksum":"450015000","operations":60000,"pairs":30000,"sha256":"18ebf68116a7c31d144f39f78e9e6ef29b14b3b6ca8fbcce44894cf4b0deea98","threads":1,"throughput_ops_per_second":4515935.041285055,"timing":{"mad_ns":166888.0,"max_ns":13832664.0,"mean_ns":13297284.2,"median_ns":13286285.0,"min_ns":12948663.0,"p95_ns":13733435.0,"raw_ns":[13302910.0,13412173.0,13725159.0,13137664.0,13066919.0,13478831.0,13735504.0,12948663.0,12999669.0,13330781.0,13337652.0,13242480.0,13473544.0,13832664.0,13455136.0,13277051.0,13119397.0,13395327.0,13286285.0,13160828.0,13008191.0,13056403.0,13085276.0,13228169.0,13335429.0],"samples":25}},"speedup":1.0181034803935036},"2":{"baseline":{"checksum":"225015000","operations":60000,"pairs":30000,"sha256":"287a4184ecfe5cbe794aaa8868604857c8bf4fda9628fed362e86a277470012d","threads":2,"throughput_ops_per_second":8701398.880391005,"timing":{"mad_ns":722125.0,"max_ns":8402626.0,"mean_ns":6996126.92,"median_ns":6895443.0,"min_ns":5960471.0,"p95_ns":8166647.0,"raw_ns":[6243853.0,8131843.0,6084997.0,8402626.0,5960471.0,7360245.0,6388088.0,7682104.0,6131907.0,7667412.0,6357222.0,7792308.0,6040130.0,7578650.0,6497221.0,7448096.0,6173318.0,8175348.0,6168110.0,7828532.0,6267719.0,7609205.0,6541136.0,7477189.0,6895443.0],"samples":25}},"optimized":{"checksum":"225015000","operations":60000,"pairs":30000,"sha256":"4115bf8db069cf46710595b0a3fa284151f60486f0f8fd91f0276586618ff70a","threads":2,"throughput_ops_per_second":9103198.408760918,"timing":{"mad_ns":37216.0,"max_ns":6824578.0,"mean_ns":6619904.68,"median_ns":6591090.0,"min_ns":6521527.0,"p95_ns":6752140.0,"raw_ns":[6569198.0,6637860.0,6675166.0,6570289.0,6547255.0,6579553.0,6577960.0,6744248.0,6554606.0,6521527.0,6536359.0,6729116.0,6590078.0,6608285.0,6615867.0,6581496.0,6628306.0,6754113.0,6671490.0,6591090.0,6557831.0,6605411.0,6551151.0,6674784.0,6824578.0],"samples":25}},"speedup":1.0461764290883602},"4":{"baseline":{"checksum":"112515000","operations":60000,"pairs":30000,"sha256":"a4f32268d692168b39e510f0da8f9c503a0e85ebb0013e9f3a4244301f5948d9","threads":4,"throughput_ops_per_second":12165672.122970613,"timing":{"mad_ns":949574.0,"max_ns":6249637.0,"mean_ns":4733638.2,"median_ns":4931910.0,"min_ns":2966125.0,"p95_ns":6192781.6,"raw_ns":[5020071.0,5951909.0,4949957.0,5958088.0,4931160.0,5881484.0,4957028.0,6249637.0,4931910.0,3895017.0,3074807.0,3896019.0,3023300.0,5563251.0,5801715.0,3836140.0,6091848.0,4115776.0,6218015.0,4177307.0,5488820.0,4008196.0,3220233.0,4133142.0,2966125.0],"samples":25}},"optimized":{"checksum":"112515000","operations":60000,"pairs":30000,"sha256":"7f77ca99ba240c6dc5f93752c126c1c25aa980504bea98ee1047210121c510fd","threads":4,"throughput_ops_per_second":17315932.360505015,"timing":{"mad_ns":80871.0,"max_ns":3730022.0,"mean_ns":3458762.04,"median_ns":3465017.0,"min_ns":3206823.0,"p95_ns":3677273.8,"raw_ns":[3485287.0,3523715.0,3465017.0,3576603.0,3687539.0,3545888.0,3332540.0,3636213.0,3396846.0,3479138.0,3439229.0,3356797.0,3474752.0,3580689.0,3403015.0,3316957.0,3206823.0,3430156.0,3510885.0,3366671.0,3331007.0,3523284.0,3269486.0,3400492.0,3730022.0],"samples":25}},"speedup":1.4233436661349714}},"cuda_decision":{"cpu_gpu_numeric_comparison_available":false,"custom_cuda_kernel_implemented":false,"decision":"no_cuda_device_on_validation_machine","gate_j_cuda_evidence_status":"hardware_blocked_numeric_gpu_comparison","torch_build":"2.10.0+cpu","torch_cuda_available":false,"torch_cuda_device_count":0},"gate_j_status":"pending_gpu_and_pybind_numeric_comparisons_on_capable_environment","hardware":{"cuda_available":false,"cuda_device_count":0,"cxx_compiler":"c++ (Debian 14.2.0-19) 14.2.0","logical_cpu_count":5,"memory_bytes":6368813056,"numpy_version":"2.3.5","nvidia_smi_available":false,"physical_cpu_count":5,"platform":"Linux-6.18.35-x86_64-with-glibc2.41","process_affinity":[0,1,2,3,4],"processor":"AMD EPYC 9V74 80-Core Processor","python":"3.13.5","scikit_learn_version":"1.8.0","torch_num_threads_initial":1,"torch_version":"2.10.0+cpu"},"historical_execution_latency_impact":"blocked_gate_c","latency_injection":{"decision_intervals":{"100us":{"imitation_numpy":{"decision_intervals_consumed":0.14010855999999997,"fits_within_one_interval":true,"missed_full_intervals":0,"p95_us":14.010855999999997},"ppo_trace":{"decision_intervals_consumed":0.17529882,"fits_within_one_interval":true,"missed_full_intervals":0,"p95_us":17.529882},"temporal_5s_trace":{"decision_intervals_consumed":1.4416332999999997,"fits_within_one_interval":false,"missed_full_intervals":1,"p95_us":144.16332999999997}},"250us":{"imitation_numpy":{"decision_intervals_consumed":0.05604342399999999,"fits_within_one_interval":true,"missed_full_intervals":0,"p95_us":14.010855999999997},"ppo_trace":{"decision_intervals_consumed":0.070119528,"fits_within_one_interval":true,"missed_full_intervals":0,"p95_us":17.529882},"temporal_5s_trace":{"decision_intervals_consumed":0.5766533199999999,"fits_within_one_interval":true,"missed_full_intervals":0,"p95_us":144.16332999999997}},"25us":{"imitation_numpy":{"decision_intervals_consumed":0.5604342399999999,"fits_within_one_interval":true,"missed_full_intervals":0,"p95_us":14.010855999999997},"ppo_trace":{"decision_intervals_consumed":0.70119528,"fits_within_one_interval":true,"missed_full_intervals":0,"p95_us":17.529882},"temporal_5s_trace":{"decision_intervals_consumed":5.766533199999999,"fits_within_one_interval":false,"missed_full_intervals":5,"p95_us":144.16332999999997}},"500us":{"imitation_numpy":{"decision_intervals_consumed":0.028021711999999994,"fits_within_one_interval":true,"missed_full_intervals":0,"p95_us":14.010855999999997},"ppo_trace":{"decision_intervals_consumed":0.035059764,"fits_within_one_interval":true,"missed_full_intervals":0,"p95_us":17.529882},"temporal_5s_trace":{"decision_intervals_consumed":0.28832665999999996,"fits_within_one_interval":true,"missed_full_intervals":0,"p95_us":144.16332999999997}},"50us":{"imitation_numpy":{"decision_intervals_consumed":0.28021711999999993,"fits_within_one_interval":true,"missed_full_intervals":0,"p95_us":14.010855999999997},"ppo_trace":{"decision_intervals_consumed":0.35059764,"fits_within_one_interval":true,"missed_full_intervals":0,"p95_us":17.529882},"temporal_5s_trace":{"decision_intervals_consumed":2.8832665999999993,"fits_within_one_interval":false,"missed_full_intervals":2,"p95_us":144.16332999999997}}},"interpretation":"Measured p95 compute latency is converted into decision-grid occupancy. Historical price-path impact remains blocked by Gate C.","p95_us":{"imitation_numpy":14.010855999999997,"ppo_trace":17.529882,"temporal_5s_trace":144.16332999999997},"status":"timing_budget_injection_not_historical_execution_claim"},"model_inference":{"imitation":{"1":{"numpy":{"mad_ns":67.80000000000109,"max_ns":15316.0,"mean_ns":12302.372,"median_ns":11881.28,"min_ns":11769.92,"p95_ns":14010.855999999996,"raw_ns":[11942.58,11882.28,11820.8,11769.92,12369.22,12415.68,11811.98,15316.0,11814.98,11880.28],"samples":10,"throughput_rows_per_second":84166.01578281127},"torchscript_trace":{"mad_ns":45.16000000000167,"max_ns":10362.02,"mean_ns":9952.676,"median_ns":9837.04,"min_ns":9760.94,"p95_ns":10353.011,"raw_ns":[9867.68,10362.02,9760.94,9813.6,9851.26,9784.96,9798.8,9822.82,10122.68,10342.0],"samples":10,"throughput_rows_per_second":101656.5958865675}},"256":{"numpy":{"mad_ns":1070.699999999997,"max_ns":70146.4,"mean_ns":63828.98,"median_ns":63040.729999999996,"min_ns":61513.96,"p95_ns":68819.989,"raw_ns":[63239.32,63545.38,62795.86,62842.14,67198.82,63799.56,61658.16,61550.2,61513.96,70146.4],"samples":10,"throughput_rows_per_second":4060866.680953727},"torchscript_trace":{"mad_ns":722.4700000000012,"max_ns":41542.02,"mean_ns":29031.806,"median_ns":26831.33,"min_ns":25910.16,"p95_ns":37085.78699999999,"raw_ns":[31639.28,25910.16,27322.06,31473.64,41542.02,26227.44,26340.6,27540.58,26095.64,26226.64],"samples":10,"throughput_rows_per_second":9541084.992805053}},"32":{"numpy":{"mad_ns":142.71999999999935,"max_ns":20789.54,"mean_ns":19067.64,"median_ns":18479.71,"min_ns":18301.64,"p95_ns":20635.136,"raw_ns":[18737.68,20227.72,18454.28,18447.26,18505.14,20789.54,18394.38,18301.64,18372.34,20446.42],"samples":10,"throughput_rows_per_second":1731628.9054319577},"torchscript_trace":{"mad_ns":233.03999999999996,"max_ns":30687.88,"mean_ns":14528.162,"median_ns":12675.96,"min_ns":12300.7,"p95_ns":23170.06299999998,"raw_ns":[12539.28,12655.02,30687.88,12702.9,12907.2,12441.12,13981.62,12369.0,12300.7,12696.9],"samples":10,"throughput_rows_per_second":2524463.6303680353}}},"ppo_seed_27":{"cpu":{"1":{"1":{"eager":{"mad_ns":403.39999999999964,"max_ns":32565.86,"mean_ns":31088.854,"median_ns":31148.46,"min_ns":29412.18,"p95_ns":32136.02,"raw_ns":[31575.8,30841.32,31089.48,31527.92,30073.56,31610.66,32565.86,30984.32,29412.18,31207.44],"samples":10,"throughput_rows_per_second":32104.315911605263},"torchscript_trace":{"mad_ns":372.7400000000016,"max_ns":17785.68,"mean_ns":16021.666000000001,"median_ns":15835.560000000001,"min_ns":15323.4,"p95_ns":17529.882,"raw_ns":[17785.68,15519.3,15926.1,15925.5,15406.34,17217.24,15323.4,15745.62,16031.46,15336.02],"samples":10,"throughput_rows_per_second":63149.013991295535}},"256":{"eager":{"mad_ns":1464.0800000000017,"max_ns":111166.86,"mean_ns":98712.784,"median_ns":96498.13